{
  "fixture_version": "0.1.0",
  "case_id": "identical-link-retry-collapses",
  "category": "recovery",
  "kind": "trace_identity",
  "input": {
    "items": [
      { "kind": "LINK", "trace_id": "aaaaaaaaaaaaaaaaaaaaaaaaaaaaaaaa", "recording_span_id": "bbbbbbbbbbbbbbbb", "target_trace_id": "cccccccccccccccccccccccccccccccc", "target_span_id": "dddddddddddddddd", "trace_state": "vendor=x", "flags": 1 },
      { "kind": "LINK", "trace_id": "aaaaaaaaaaaaaaaaaaaaaaaaaaaaaaaa", "recording_span_id": "bbbbbbbbbbbbbbbb", "target_trace_id": "cccccccccccccccccccccccccccccccc", "target_span_id": "dddddddddddddddd", "trace_state": "vendor=x", "flags": 1 }
    ]
  },
  "expected": "DUPLICATE"
}
