{
  "fixture_version": "0.1.0",
  "case_id": "normalized-facts-request",
  "category": "positive",
  "kind": "request",
  "input": {
    "request": { "method": "GET", "path": "/v1/evidence/facts", "accept": "application/json;q=1.000", "query": [["event_name", "usage"], ["limit", "100"]] },
    "expected_code": "OK"
  },
  "expected": "ACCEPT"
}
